,时间,风格,时期,艺术类型,绘画媒材,收藏类型,艺术品名称
493,1901,後印象派,2nd Tahiti period,裸體畫,"油彩, 畫布",奥赛博物馆,and the gold of their bodies
494,1901,後印象派,2nd Tahiti period,風俗畫,"油彩, 畫布",普希金博物館,flight
495,1901,後印象派,2nd Tahiti period,風景畫,"油彩, 畫布",卡內基美術館,landscape with three figures
496,1901,後印象派,2nd Tahiti period,風景畫,"油彩, 畫布",私人收藏,marquesan landscape with horses
497,1901,後印象派,2nd Tahiti period,静物畫,"油彩, 畫布",私人收藏,still life with l esperance
498,1901,後印象派,2nd Tahiti period,静物畫,"油彩, 畫布",埃尔米塔日博物馆,still life with sunflowers on an armchair
499,1901,掐絲琺瑯彩主義,2nd Tahiti period,風景畫,"油彩, 畫布",私人收藏,tahitian idyll
500,1901,掐絲琺瑯彩主義,2nd Tahiti period,肖像畫,"油彩, 畫布",芝加哥藝術博物館,tahitian woman and two children
501,1901,後印象派,,風俗畫,,現代藝術博物館,change of residence
502,1902,掐絲琺瑯彩主義,2nd Tahiti period,裸體畫,"油彩, 畫布",私人收藏,bathers
503,1902,後印象派,2nd Tahiti period,allegorical painting,"油彩, 畫布",奧德羅普格園林博物館,adam and eve
504,1902,後印象派,2nd Tahiti period,allegorical painting,"油彩, 畫布",弗柯望博物館,barbarous tales
505,1902,後印象派,2nd Tahiti period,裸體畫,,,crouching tahitian woman
506,1902,後印象派,2nd Tahiti period,肖像畫,"油彩, 畫布",弗柯望博物館,girl with a fan
507,1902,掐絲琺瑯彩主義,2nd Tahiti period,風俗畫,"油彩, 畫布",弗柯望博物館,riders on the beach
508,1902,掐絲琺瑯彩主義,2nd Tahiti period,風俗畫,"油彩, 畫布",弗柯望博物館,riders on the beach ii
509,1902,後印象派,2nd Tahiti period,静物畫,"油彩, 畫布",普希金博物館,still life with parrots
510,1902,掐絲琺瑯彩主義,2nd Tahiti period,風俗畫,"油彩, 畫布",,the call
511,1902,掐絲琺瑯彩主義,2nd Tahiti period,肖像畫,"油彩, 畫布",布尔勒收藏展览馆,the offering
512,1902,後印象派,2nd Tahiti period,肖像畫,"油彩, 畫布",,the sorcerer of hiva oa marquesan man in the red cape
513,1902,掐絲琺瑯彩主義,2nd Tahiti period,肖像畫,"油彩, 畫布",私人收藏,two women flowered hair
514,1903,後印象派,2nd Tahiti period,自畫像,"油彩, 畫布","Kunstmuseum Bern, Bern, Switzerland",self portrait with spectacles
515,1903,後印象派,2nd Tahiti period,風俗畫,"油彩, 畫布",國家藝廊,the invocation
516,1903,後印象派,2nd Tahiti period,風俗畫,"透明水彩, 紙質",波士頓美術館,women and white horse
